outlet,video_id,author,text,likes,published_at,reply_count,source,text_clean,score_positive,score_negative,score_neutral,score_compound,sentiment_label
TVC,L9ZGqeUas-k,@benzzymonaconwa,The woman humble APKPABIO 😅,0,2025-03-05T23:09:30Z,0,YouTube,The woman humble APKPABIO,0.0,0.0,1.0,0.0,Neutral
TVC,L9ZGqeUas-k,@balabenjaminharuna,Why are his hands shaking?😢,0,2025-03-05T19:33:09Z,0,YouTube,Why are his hands shaking?,0.0,0.298,0.702,-0.1779,Negative
TVC,L9ZGqeUas-k,@DeEmperor1,I love Senator Natasha.,0,2025-03-06T04:29:34Z,0,YouTube,I love Senator Natasha.,0.583,0.0,0.417,0.6369,Positive
TVC,L9ZGqeUas-k,@oribhabormathiasedose9160,Some oldmen are so shameless,0,2025-03-05T19:44:46Z,0,YouTube,Some oldmen are so shameless,0.0,0.438,0.562,-0.4795,Negative
TVC,L9ZGqeUas-k,@rafiuowolabi-hu7tx,Even if his vice stands at this defence he's still going to be at  his boss support this Nigeria not America we all know how they operate it's their way hell fire is their home rest,0,2025-03-05T16:23:54Z,0,YouTube,Even if his vice stands at this defence he's still going to be at his boss support this Nigeria not America we all know how they operate it's their way hell fire is their home rest,0.097,0.162,0.741,-0.5859,Negative
TVC,L9ZGqeUas-k,@ObinnaJude-b1n,Please this woman should abide by senate order,0,2025-03-05T21:40:11Z,0,YouTube,Please this woman should abide by senate order,0.247,0.0,0.753,0.3182,Positive
TVC,L9ZGqeUas-k,@ameduattai7168,Sanate presido leave that woman alone.,0,2025-03-05T16:36:44Z,0,YouTube,Sanate presido leave that woman alone.,0.0,0.444,0.556,-0.296,Negative
TVC,L9ZGqeUas-k,@nkechionyeguke5597,Shameless man,0,2025-03-06T11:28:00Z,0,YouTube,Shameless man,0.0,0.706,0.294,-0.34,Negative
TVC,L9ZGqeUas-k,@Bob-wq7lf,White lion roars on,0,2025-03-05T16:17:30Z,0,YouTube,White lion roars on,0.0,0.0,1.0,0.0,Neutral
TVC,L9ZGqeUas-k,@ddproperties3860,Number 3 citizen for a reason,0,2025-03-06T14:21:36Z,0,YouTube,Number 3 citizen for a reason,0.206,0.0,0.794,0.0772,Positive
TVC,L9ZGqeUas-k,@BenedictaDuru-x4u,Beauty and Brain not all these local celebrities,0,2025-03-08T12:56:00Z,0,YouTube,Beauty and Brain not all these local celebrities,0.352,0.0,0.648,0.5859,Positive
TVC,L9ZGqeUas-k,@EmmanuelAmagong-v1j,Is he reading from paper on how to defend him self because I don't understand,0,2025-03-05T19:42:24Z,0,YouTube,Is he reading from paper on how to defend him self because I don't understand,0.0,0.0,1.0,0.0,Neutral
TVC,L9ZGqeUas-k,@saniidi957,"This country is in serious mess , how a senate preside over his own case? He should step down and prove his Innocent.",0,2025-03-05T19:36:32Z,0,YouTube,"This country is in serious mess , how a senate preside over his own case? He should step down and prove his Innocent.",0.092,0.145,0.763,-0.1027,Negative
TVC,L9ZGqeUas-k,@annborlyne9983,"Oh my goodness, Natasha is the real Boss Lady.",0,2025-03-06T05:27:23Z,0,YouTube,"Oh my goodness, Natasha is the real Boss Lady.",0.273,0.0,0.727,0.4588,Positive
TVC,L9ZGqeUas-k,@exceluchenna,correct woman,0,2025-03-06T16:01:02Z,0,YouTube,correct woman,0.0,0.0,1.0,0.0,Neutral
TVC,L9ZGqeUas-k,@louisemulikita2745,His reading his own thoughts 🤔,0,2025-03-22T14:33:52Z,0,YouTube,His reading his own thoughts,0.0,0.0,1.0,0.0,Neutral
TVC,L9ZGqeUas-k,@francisafolabi6485,Akpabio should step aside while investigation/court proceeding into this case is ongoing.,0,2025-03-05T21:21:53Z,0,YouTube,Akpabio should step aside while investigationcourt proceeding into this case is ongoing.,0.0,0.0,1.0,0.0,Neutral
TVC,L9ZGqeUas-k,@Cornelius5378,She is respecting her dignity. Senate president will humble himself.,0,2025-03-05T19:20:33Z,0,YouTube,She is respecting her dignity. Senate president will humble himself.,0.424,0.0,0.576,0.7096,Positive
TVC,L9ZGqeUas-k,@lawrenceokechukwu8680,This Calabar man should step down immediately and possibly get jailed,0,2025-03-06T04:41:41Z,0,YouTube,This Calabar man should step down immediately and possibly get jailed,0.0,0.242,0.758,-0.4939,Negative
TVC,L9ZGqeUas-k,@davidsamaila3675,Make i believe all of wuna? No please. Both Natasha and senate president i no believe them.,1,2025-03-05T17:12:59Z,1,YouTube,Make i believe all of wuna? No please. Both Natasha and senate president i no believe them.,0.0,0.217,0.783,-0.4874,Negative
TVC,L9ZGqeUas-k,@nwachigozirinwosu2657,"THESE ARE PEOPLE THAT WILL MOVE AFRICA FORWARD? 

STORY",0,2025-03-05T17:00:51Z,0,YouTube,THESE ARE PEOPLE THAT WILL MOVE AFRICA FORWARD? STORY,0.0,0.0,1.0,0.0,Neutral
TVC,L9ZGqeUas-k,@Ndukacn,Step aside for this to be investigated. You remaining there lookc dictorial.,0,2025-03-06T04:02:19Z,0,YouTube,Step aside for this to be investigated. You remaining there lookc dictorial.,0.0,0.0,1.0,0.0,Neutral
TVC,L9ZGqeUas-k,@kennethchinweike6346,"This could be the salvation of Nigeria on the way 🤷‍♀
Mr Senate President, just submit yourself to a forensic enquiry and please don't preside over your case",0,2025-03-05T16:47:04Z,0,YouTube,"This could be the salvation of Nigeria on the way Mr Senate President, just submit yourself to a forensic enquiry and please don't preside over your case",0.081,0.0,0.919,0.3182,Positive
TVC,L9ZGqeUas-k,@chinedupromise,My dear speak out,0,2025-03-05T21:03:38Z,0,YouTube,My dear speak out,0.464,0.0,0.536,0.3818,Positive
TVC,L9ZGqeUas-k,@austinelonut461,She is indeed educated,0,2025-03-05T21:35:34Z,0,YouTube,She is indeed educated,0.0,0.0,1.0,0.0,Neutral
TVC,L9ZGqeUas-k,@Serene-c2o,So this president of the senate is now judge and jury in his own matter? How will  justice be served fairly. This is laughable!,0,2025-03-05T18:23:21Z,0,YouTube,So this president of the senate is now judge and jury in his own matter? How will justice be served fairly. This is laughable!,0.222,0.0,0.778,0.6114,Positive
TVC,L9ZGqeUas-k,@EqualityPhilip,I wish the Senate will allow more women like Senator Natasha,0,2025-03-06T08:22:20Z,0,YouTube,I wish the Senate will allow more women like Senator Natasha,0.48,0.0,0.52,0.749,Positive
TVC,L9ZGqeUas-k,@benbiji2065,Now I can see how she’s handling her husband at home,0,2025-03-06T08:06:02Z,0,YouTube,Now I can see how shes handling her husband at home,0.0,0.0,1.0,0.0,Neutral
TVC,L9ZGqeUas-k,@arnoldfinecountry,dem don pour am ice water,0,2025-03-06T06:28:30Z,0,YouTube,dem don pour am ice water,0.0,0.0,1.0,0.0,Neutral
TVC,L9ZGqeUas-k,@olawalearomolaran6039,The SP appears not to be coherent again. This matter dey serious o. May the Lord deliver the SP.,0,2025-03-05T20:04:57Z,0,YouTube,The SP appears not to be coherent again. This matter dey serious o. May the Lord deliver the SP.,0.058,0.067,0.875,-0.0451,Neutral
TVC,L9ZGqeUas-k,@tinukealabi8366,But you can't petition the Senate for an issue you signed yourself,0,2025-03-05T17:18:53Z,0,YouTube,But you can't petition the Senate for an issue you signed yourself,0.0,0.0,1.0,0.0,Neutral
TVC,L9ZGqeUas-k,@lightcity1193,Senate president step down for now to clear yourself,0,2025-03-06T00:03:05Z,0,YouTube,Senate president step down for now to clear yourself,0.245,0.0,0.755,0.3818,Positive
TVC,L9ZGqeUas-k,@iinuwa,Shameless man... Only in Nigeria are people with known questionable characters are selected as leaders,0,2025-03-05T22:05:24Z,0,YouTube,Shameless man... Only in Nigeria are people with known questionable characters are selected as leaders,0.0,0.261,0.739,-0.5574,Negative
TVC,L9ZGqeUas-k,@Sachealbrainbox,All these eloquence should be used to bring alleviating policies ... Nice bills... Not all these childish and weak minded talks,0,2025-03-05T17:30:30Z,0,YouTube,All these eloquence should be used to bring alleviating policies ... Nice bills... Not all these childish and weak minded talks,0.183,0.113,0.703,0.1994,Positive
TVC,L9ZGqeUas-k,@gladysiyabere5316,how can he be the judge of his case chai am I truly from this country chai.,0,2025-03-07T08:23:18Z,0,YouTube,how can he be the judge of his case chai am I truly from this country chai.,0.153,0.0,0.847,0.4404,Positive
TVC,L9ZGqeUas-k,@elyaksphotography3605,"Did the text in that book really said ""himself""?",0,2025-03-05T22:30:39Z,0,YouTube,Did the text in that book really said himself?,0.0,0.0,1.0,0.0,Neutral
TVC,L9ZGqeUas-k,@Gaduminati,"there is no Senate President, it's President of the Nigerian Senate.",0,2025-03-25T03:34:07Z,0,YouTube,"there is no Senate President, it's President of the Nigerian Senate.",0.0,0.18,0.82,-0.296,Negative
TVC,L9ZGqeUas-k,@ofuasiachuks4408,"In a sane country, Akpabio should step down temporarily until this is resolved",0,2025-03-06T05:53:51Z,0,YouTube,"In a sane country, Akpabio should step down temporarily until this is resolved",0.124,0.0,0.876,0.1779,Positive
TVC,L9ZGqeUas-k,@MxMx_Art,Shame shame shame akpabio,0,2025-03-05T17:35:03Z,0,YouTube,Shame shame shame akpabio,0.0,0.903,0.097,-0.8519,Negative
TVC,L9ZGqeUas-k,@prottogaming,"What if she misunderstood him?

Nobody is saying this...what a cold world.",0,2025-03-13T22:53:12Z,0,YouTube,What if she misunderstood him?Nobody is saying this...what a cold world.,0.0,0.194,0.806,-0.34,Negative
TVC,L9ZGqeUas-k,@WalterRoland-gb2ib,"Wetin de worry this fool, na wetin de ask you be this?",0,2025-03-05T22:26:06Z,0,YouTube,"Wetin de worry this fool, na wetin de ask you be this?",0.0,0.386,0.614,-0.7411,Negative
TVC,L9ZGqeUas-k,@Sachealbrainbox,We need more serious people in the Senate not those disgracing Nigeria ... All these petitions are very childish abeg... Is this secondary school?,0,2025-03-05T17:29:33Z,0,YouTube,We need more serious people in the Senate not those disgracing Nigeria ... All these petitions are very childish abeg... Is this secondary school?,0.0,0.157,0.843,-0.4742,Negative
TVC,L9ZGqeUas-k,@buchiokwuofu151,Imagine turning her mic off.,0,2025-03-05T22:14:19Z,0,YouTube,Imagine turning her mic off.,0.0,0.0,1.0,0.0,Neutral
TVC,L9ZGqeUas-k,@davidewuzie8424,"If we are in a working country, this Senate President would have stepped down for now",0,2025-03-05T17:36:47Z,0,YouTube,"If we are in a working country, this Senate President would have stepped down for now",0.0,0.0,1.0,0.0,Neutral
TVC,L9ZGqeUas-k,@Miracle5038,Am accused passing punishment to a defendant Naija.,0,2025-03-07T07:03:22Z,0,YouTube,Am accused passing punishment to a defendant Naija.,0.0,0.474,0.526,-0.6597,Negative
TVC,L9ZGqeUas-k,@e_____esama,See as Akpabio Don humble,0,2025-03-05T22:49:36Z,0,YouTube,See as Akpabio Don humble,0.0,0.0,1.0,0.0,Neutral
TVC,L9ZGqeUas-k,@scriptureinsights-q1t,I pray this Man should not treat or address this matter in anyway as an illiterate,0,2025-03-05T17:02:15Z,0,YouTube,I pray this Man should not treat or address this matter in anyway as an illiterate,0.183,0.121,0.696,0.0431,Neutral
TVC,L9ZGqeUas-k,@bekeetornbari261,"Senator Natasha Akpoti is in her right, she is in her right to be listened to.",0,2025-03-05T19:43:51Z,0,YouTube,"Senator Natasha Akpoti is in her right, she is in her right to be listened to.",0.0,0.0,1.0,0.0,Neutral
TVC,L9ZGqeUas-k,@OluwaseunAkinbobola,If not they don’t hav sense.. Nigeria has pressing issues than all this bull shit,0,2025-03-05T17:53:11Z,0,YouTube,If not they dont hav sense.. Nigeria has pressing issues than all this bull shit,0.0,0.205,0.795,-0.5574,Negative
TVC,L9ZGqeUas-k,@olofinbayo9909,She is their to bully her ways in the senate.,0,2025-03-05T18:00:09Z,0,YouTube,She is their to bully her ways in the senate.,0.0,0.262,0.738,-0.4939,Negative
TVC,L9ZGqeUas-k,@No-Slacking,See his mouth saying Ket the Almighty God step in to vindicate the just. Thank God you invited Him in and He will surely come and expose you.,0,2025-03-06T00:21:43Z,0,YouTube,See his mouth saying Ket the Almighty God step in to vindicate the just. Thank God you invited Him in and He will surely come and expose you.,0.316,0.046,0.638,0.8074,Positive
TVC,L9ZGqeUas-k,@UyAndrew-l4i,But the case has already been filed in the social media public court. Let the public do the investigation and pass judgement.,0,2025-03-05T21:37:45Z,0,YouTube,But the case has already been filed in the social media public court. Let the public do the investigation and pass judgement.,0.0,0.0,1.0,0.0,Neutral
TVC,L9ZGqeUas-k,@olamileanongod_1,😅😅😂am just here laughing 😅 to God be the glory !,0,2025-03-05T21:49:04Z,0,YouTube,am just here laughing to God be the glory !,0.565,0.0,0.435,0.8439,Positive
TVC,L9ZGqeUas-k,@william1126,😅😅😅😅😅😅 Akpabio you are in trouble,0,2025-03-05T16:52:51Z,0,YouTube,Akpabio you are in trouble,0.0,0.403,0.597,-0.4019,Negative
TVC,L9ZGqeUas-k,@bankyvizzyyoungcraft2311,Them dey make Una focus make dem for park money 😂,0,2025-03-05T23:12:45Z,0,YouTube,Them dey make Una focus make dem for park money,0.0,0.0,1.0,0.0,Neutral
TVC,L9ZGqeUas-k,@youngpraiseamborosdavid4269,Person wey dey fault the asept say dem they fault,0,2025-03-08T10:25:58Z,0,YouTube,Person wey dey fault the asept say dem they fault,0.0,0.403,0.597,-0.6597,Negative
TVC,L9ZGqeUas-k,@Iamdessy001,"In the World of Many Akpabio, be a Senator Nathasa Uduagan, refused to be silenced",0,2025-03-06T13:12:02Z,0,YouTube,"In the World of Many Akpabio, be a Senator Nathasa Uduagan, refused to be silenced",0.0,0.136,0.864,-0.296,Negative
TVC,L9ZGqeUas-k,@gloriaelemele4481,"The audacious, bold and quintessential Sen. Natasha, the true face of the girl child, I salute you ma!! 

As for the senate president, how can you be both the judge and jury in a case that clearly accuses you of sexual harassment? The proper position is for you to step aside for investigations to be carried out for goodness sake.",0,2025-03-06T12:12:17Z,0,YouTube,"The audacious, bold and quintessential Sen. Natasha, the true face of the girl child, I salute you ma!! As for the senate president, how can you be both the judge and jury in a case that clearly accuses you of sexual harassment? The proper position is for you to step aside for investigations to be carried out for goodness sake.",0.187,0.081,0.731,0.7707,Positive
TVC,L9ZGqeUas-k,@leoexzee5365,These are the reason you keep records of conversations as evidence  with your phone anywhere,0,2025-03-07T08:34:30Z,0,YouTube,These are the reason you keep records of conversations as evidence with your phone anywhere,0.0,0.0,1.0,0.0,Neutral
TVC,L9ZGqeUas-k,@mindbuildernow,This man should have some shame and resign!!! Of course he has no shame.,0,2025-03-06T15:13:17Z,0,YouTube,This man should have some shame and resign!!! Of course he has no shame.,0.128,0.32,0.552,-0.5889,Negative
TVC,L9ZGqeUas-k,@emyokalla3236,Shameless Akpabio!,0,2025-03-05T16:40:56Z,0,YouTube,Shameless Akpabio!,0.0,0.729,0.271,-0.4003,Negative
TVC,L9ZGqeUas-k,@richardkinga1008,"Is this what senators spend their time on, when the country has pressing problems.",0,2025-03-05T20:48:37Z,0,YouTube,"Is this what senators spend their time on, when the country has pressing problems.",0.0,0.172,0.828,-0.4019,Negative
TVC,L9ZGqeUas-k,@KingsleyEleweke,"This your order 10 and privilages, pls dear Natasha, is that the only order of Nigeria senate?",0,2025-03-07T08:19:27Z,0,YouTube,"This your order 10 and privilages, pls dear Natasha, is that the only order of Nigeria senate?",0.206,0.0,0.794,0.4404,Positive
TVC,L9ZGqeUas-k,@NelsonGilbert-u2t,Senate president is speaking with no confidence if you can noticed how he talked,0,2025-03-05T21:17:13Z,0,YouTube,Senate president is speaking with no confidence if you can noticed how he talked,0.0,0.172,0.828,-0.4023,Negative
TVC,L9ZGqeUas-k,@sundaychidiebere-cs6el,This man should step down till he is proven innocent....its a shame to nigerian government  to pamper issues like dis its a shame,0,2025-03-05T20:01:41Z,0,YouTube,This man should step down till he is proven innocent....its a shame to nigerian government to pamper issues like dis its a shame,0.087,0.216,0.697,-0.5719,Negative
TVC,L9ZGqeUas-k,@rakiyamusa845,Is the senate president learning to read now? And when has the senate turned to court with accused person as the judge! Please naija,0,2025-03-05T16:45:41Z,0,YouTube,Is the senate president learning to read now? And when has the senate turned to court with accused person as the judge! Please naija,0.097,0.082,0.821,0.1007,Positive
TVC,L9ZGqeUas-k,@boluwajiolalekan4173,Shame on you sir,0,2025-03-06T08:33:01Z,0,YouTube,Shame on you sir,0.0,0.508,0.492,-0.4767,Negative
TVC,L9ZGqeUas-k,@AdaFaith-yy1eg,"Oga senate president , remember, if is true God will not back you up, you are going down,.",0,2025-03-05T21:40:21Z,0,YouTube,"Oga senate president , remember, if is true God will not back you up, you are going down,.",0.234,0.0,0.766,0.5994,Positive
TVC,L9ZGqeUas-k,@nelsonzrh,"This senate president is so shameless… in a case like this that involves him, even if a useless house rules forbid it, he should allow it to clear his name.  What a shameless set of leaders.",0,2025-03-05T16:59:10Z,0,YouTube,"This senate president is so shameless in a case like this that involves him, even if a useless house rules forbid it, he should allow it to clear his name. What a shameless set of leaders.",0.15,0.228,0.622,-0.5598,Negative
TVC,L9ZGqeUas-k,@trancy14,"Omo, this man is finished if the proofs are out, he and his wife will really be put to shame. Finished man",0,2025-03-05T20:59:43Z,0,YouTube,"Omo, this man is finished if the proofs are out, he and his wife will really be put to shame. Finished man",0.0,0.129,0.871,-0.4767,Negative
TVC,L9ZGqeUas-k,@KingsleyElias-u7g,Baba don humble,0,2025-03-06T11:30:12Z,0,YouTube,Baba don humble,0.0,0.0,1.0,0.0,Neutral
TVC,L9ZGqeUas-k,@ApstHumphreyEreziaye,You can’t judge your own case.. here Mr senator .. someone should oversees ..,0,2025-03-11T19:30:19Z,0,YouTube,You cant judge your own case.. here Mr senator .. someone should oversees ..,0.0,0.0,1.0,0.0,Neutral
TVC,L9ZGqeUas-k,@maziochendu5258,😂😂😂😂😂 I know say this woman go bring feminist enter senate House 😂😂😂,1,2025-03-05T17:38:20Z,0,YouTube,I know say this woman go bring feminist enter senate House,0.0,0.0,1.0,0.0,Neutral
TVC,L9ZGqeUas-k,@thetruth00793,Nigeria senate is truly a joke and a shame to the world how would an accused preside over it's own case what do you all expect he should step aside and a neutral body handles the senate for now,0,2025-03-06T06:39:18Z,0,YouTube,Nigeria senate is truly a joke and a shame to the world how would an accused preside over it's own case what do you all expect he should step aside and a neutral body handles the senate for now,0.112,0.117,0.771,-0.0516,Negative
TVC,L9ZGqeUas-k,@samuelsotunde3622,She is a strong woman.  ✊,0,2025-03-05T22:46:59Z,0,YouTube,She is a strong woman.,0.452,0.0,0.548,0.5106,Positive
TVC,L9ZGqeUas-k,@clarak.mallah4137,"Who is that person calling her "" Naked in parliament""!! Shame on these equal men!! Nonsense people!",0,2025-03-05T21:20:00Z,0,YouTube,Who is that person calling her Naked in parliament!! Shame on these equal men!! Nonsense people!,0.0,0.332,0.668,-0.7887,Negative
TVC,L9ZGqeUas-k,@isimioluwasuyi-dw4ht,"In what Republic do a party to a petition and allegation get to sit on his own case? 

Oh yeah....the Federal Contraption of Nigeria 😂",0,2025-03-05T19:05:30Z,0,YouTube,In what Republic do a party to a petition and allegation get to sit on his own case? Oh yeah....the Federal Contraption of Nigeria,0.105,0.0,0.895,0.4019,Positive
TVC,L9ZGqeUas-k,@AbayomiJegede-o6t,This is evidence of marking mockery of the position of leadership Nigeria is a lawlessness space if not the senate president suppose to resign for proper investigation,0,2025-03-05T23:03:17Z,0,YouTube,This is evidence of marking mockery of the position of leadership Nigeria is a lawlessness space if not the senate president suppose to resign for proper investigation,0.0,0.158,0.842,-0.5719,Negative
TVC,L9ZGqeUas-k,@OperativeTulsiChristian,"IAM FEDERAL MOST HIGH GOD
VENDICATE THE JUST OLIVELY
OMEGA THANKS SIR SWEETHEART 💖",0,2025-03-18T14:40:34Z,0,YouTube,IAM FEDERAL MOST HIGH GODVENDICATE THE JUST OLIVELYOMEGA THANKS SIR SWEETHEART,0.444,0.0,0.556,0.802,Positive
TVC,L9ZGqeUas-k,@Immortality153,Naija don't play by the book oo..😂,0,2025-03-05T21:44:29Z,0,YouTube,Naija don't play by the book oo..,0.0,0.253,0.747,-0.2584,Negative
TVC,L9ZGqeUas-k,@celinecollins3935,Strong-willed woman,0,2025-03-06T00:06:52Z,0,YouTube,Strong-willed woman,0.0,0.0,1.0,0.0,Neutral
TVC,L9ZGqeUas-k,@tajirtv7,44 (4) she is out of order,0,2025-03-06T08:32:36Z,0,YouTube,44 4 she is out of order,0.0,0.0,1.0,0.0,Neutral
TVC,L9ZGqeUas-k,@godwinossai1397,The man dey respect himself. He should know that national issues is a matter of seriousness. We are not here for comedy,0,2025-03-05T21:42:41Z,0,YouTube,The man dey respect himself. He should know that national issues is a matter of seriousness. We are not here for comedy,0.165,0.13,0.706,0.224,Positive
TVC,L9ZGqeUas-k,@ifeanyiali6870,"4 years is going out this house is not discuss something important for the country no achievement 
Their discuss something those make any sense",0,2025-03-07T13:20:23Z,0,YouTube,4 years is going out this house is not discuss something important for the country no achievement Their discuss something those make any sense,0.0,0.147,0.853,-0.4199,Negative
TVC,L9ZGqeUas-k,@ayomikunjosepheyitayo-ajay1716,"So, Akpabio had to read what he could have freely said off hand.",0,2025-03-05T20:42:46Z,0,YouTube,"So, Akpabio had to read what he could have freely said off hand.",0.357,0.0,0.643,0.7269,Positive
TVC,L9ZGqeUas-k,@davidsmith-ji5ym,Oga president.....u don buy market ooooooooh😂,0,2025-03-05T17:24:56Z,0,YouTube,Oga president.....u don buy market ooooooooh,0.0,0.0,1.0,0.0,Neutral
TVC,L9ZGqeUas-k,@JusTrendyInc,Allegedly! Allegedly! Allegedly! 😂,0,2025-03-05T22:52:57Z,0,YouTube,Allegedly! Allegedly! Allegedly!,0.0,0.0,1.0,0.0,Neutral
TVC,L9ZGqeUas-k,@Noob-zi2ce,"Crazy lawmakers, if it was a common man they'll have thrown him under the bus to prove they love women. No they get a taste of how powerful women can be with these accusations and they approach it with the innocent before proven guilty perspective.",1,2025-03-05T21:49:05Z,0,YouTube,"Crazy lawmakers, if it was a common man they'll have thrown him under the bus to prove they love women. No they get a taste of how powerful women can be with these accusations and they approach it with the innocent before proven guilty perspective.",0.165,0.17,0.665,0.1779,Positive
TVC,L9ZGqeUas-k,@KingsleyOgechiOkereke,"😂😂😂😂😂😂 People wey dey dey call Natasha dey strong...o., . See Tuface , see Akpabio...😢😢😢 wetin dey happen for 9ja. This country sweet...o . See me wey dey vex say i no make money today, come see this news, come dey happy.....o",1,2025-03-05T19:32:39Z,0,YouTube,"People wey dey dey call Natasha dey strong...o., . See Tuface , see Akpabio... wetin dey happen for 9ja. This country sweet...o . See me wey dey vex say i no make money today, come see this news, come dey happy.....o",0.0,0.052,0.948,-0.296,Negative
TVC,L9ZGqeUas-k,@anthonystan5751,How is he presiding over his own matter. This is a joke,0,2025-03-05T23:15:53Z,0,YouTube,How is he presiding over his own matter. This is a joke,0.248,0.0,0.752,0.3182,Positive
TVC,L9ZGqeUas-k,@nwachukwusunday-4766,Akpabio should stepdown as Senate president,0,2025-03-05T18:41:20Z,0,YouTube,Akpabio should stepdown as Senate president,0.0,0.0,1.0,0.0,Neutral
TVC,L9ZGqeUas-k,@ikwunzekingsleyagro,"When the nation is pay them to  waste time acting drama.
There are so many issues of national importance that is seeking for attention.",0,2025-03-05T18:28:38Z,0,YouTube,When the nation is pay them to waste time acting drama.There are so many issues of national importance that is seeking for attention.,0.094,0.157,0.749,-0.1779,Negative
TVC,L9ZGqeUas-k,@endlezlive5546,Lol oga Dey read speech to defend himself 😂,0,2025-03-06T01:33:28Z,0,YouTube,Lol oga Dey read speech to defend himself,0.286,0.0,0.714,0.4215,Positive
TVC,L9ZGqeUas-k,@abdullahiusman1174,"The cases filled before courts should not stop her from submitting her petition, and the same time this same Upper Chamber rejected an order from court claiming that judiciary will not stop you from doing your  legislatives activities.",0,2025-03-05T18:25:13Z,0,YouTube,"The cases filled before courts should not stop her from submitting her petition, and the same time this same Upper Chamber rejected an order from court claiming that judiciary will not stop you from doing your legislatives activities.",0.09,0.078,0.832,-0.1341,Negative
TVC,L9ZGqeUas-k,@joshuamatthew7060,"Father Lord give me a wife, daughters like Senator Natasha",0,2025-03-05T19:46:42Z,0,YouTube,"Father Lord give me a wife, daughters like Senator Natasha",0.217,0.0,0.783,0.3612,Positive
TVC,L9ZGqeUas-k,@mpbasics8285,So anytime person open mouth someone should just step down....get sense in Jesus name,0,2025-03-05T22:09:59Z,0,YouTube,So anytime person open mouth someone should just step down....get sense in Jesus name,0.0,0.0,1.0,0.0,Neutral
TVC,L9ZGqeUas-k,@emmanuelebere4247,Now I believe in education. My children will all be highly educated so that no idiot somewhere will pocket them from their right.,0,2025-03-06T00:25:12Z,0,YouTube,Now I believe in education. My children will all be highly educated so that no idiot somewhere will pocket them from their right.,0.168,0.0,0.832,0.5013,Positive
TVC,L9ZGqeUas-k,@auto-cuisine,"Her people are behind her, that's what really matters",0,2025-03-05T19:41:03Z,0,YouTube,"Her people are behind her, that's what really matters",0.148,0.0,0.852,0.101,Positive
