outlet,video_id,author,text,likes,published_at,reply_count,source,text_clean,score_positive,score_negative,score_neutral,score_compound,sentiment_label
Al_Jazeera,HfdLO3QwjtA,@ObiajuluObinna-r6b,This man should come back as a senetor respect sir❤❤❤❤❤❤❤❤❤❤❤❤❤❤❤❤❤❤❤❤❤❤❤❤❤❤❤❤❤❤❤❤❤❤❤❤❤❤❤❤❤❤❤❤❤❤❤❤❤❤❤❤❤❤❤❤❤❤❤❤❤❤❤❤❤❤❤❤❤❤❤🎉🎉🎉🎉🎉🎉🎉🎉🎉🎉🎉🎉🎉🎉🎉🎉🎉🎉🎉🎉🎉🎉🎉🎉🎉🎉🎉🎉🎉🎉🎉🎉🎉🎉🎉🎉🎉🎉🎉❤❤❤❤❤❤❤❤❤❤❤❤❤❤❤❤❤❤❤❤❤❤❤❤❤❤❤❤❤❤❤❤❤❤❤❤❤❤❤,31,2025-03-10T11:38:24Z,1,YouTube,This man should come back as a senetor respect sir,0.256,0.0,0.744,0.4767,Positive
Al_Jazeera,HfdLO3QwjtA,@nwoguchibunna949,"When they say ""Nigeria"" will happen to you, this is a real example.",9,2025-03-10T12:26:08Z,0,YouTube,"When they say Nigeria will happen to you, this is a real example.",0.0,0.0,1.0,0.0,Neutral
Al_Jazeera,HfdLO3QwjtA,@veronicaugono2822,"Thank you very much sir, treating a   senator like a student",0,2025-04-01T08:54:34Z,0,YouTube,"Thank you very much sir, treating a senator like a student",0.357,0.0,0.643,0.6124,Positive
Al_Jazeera,HfdLO3QwjtA,@umuakaigbotaauit5271,"Thank you Lady. This is the point, Her refusal was affecting her job.
Yes it goes beyond winking",1,2025-03-13T09:38:11Z,0,YouTube,"Thank you Lady. This is the point, Her refusal was affecting her job.Yes it goes beyond winking",0.135,0.0,0.865,0.3612,Positive
Al_Jazeera,HfdLO3QwjtA,@tesla_musk_reeve,This Man is been so honest with his answer I swear....,9,2025-03-10T14:10:41Z,0,YouTube,This Man is been so honest with his answer I swear....,0.294,0.083,0.623,0.6176,Positive
Al_Jazeera,HfdLO3QwjtA,@metuobinna3392,I am very satisfied with few minutes you have spoken and the  remarks you have made which is absolutely true. May God bless you Sir,21,2025-03-10T13:03:06Z,0,YouTube,I am very satisfied with few minutes you have spoken and the remarks you have made which is absolutely true. May God bless you Sir,0.351,0.0,0.649,0.8847,Positive
Al_Jazeera,HfdLO3QwjtA,@cyrusibikunleco556,"I love this man.

He said IT CANNOT STAND.
Just like Natasha said IT WILL NOT BE SUSTAINED.",10,2025-03-10T11:44:57Z,0,YouTube,I love this man.He said IT CANNOT STAND.Just like Natasha said IT WILL NOT BE SUSTAINED.,0.207,0.104,0.689,0.4749,Positive
Al_Jazeera,HfdLO3QwjtA,@akaninyeneandrew8776,This man is wisdom in Nigeria. Bravo.your explanation is clear and simple.,1,2025-03-14T14:17:13Z,0,YouTube,This man is wisdom in Nigeria. Bravo.your explanation is clear and simple.,0.375,0.0,0.625,0.7184,Positive
Al_Jazeera,HfdLO3QwjtA,@MrIbee,"Probably one of the best interview ever...so refreshing,so honest, unrehearsed, direct ,unbiased....gave solutions and kept mum on what he doesn't know.. God bless you Senator Sir",11,2025-03-10T20:23:12Z,0,YouTube,"Probably one of the best interview ever...so refreshing,so honest, unrehearsed, direct ,unbiased....gave solutions and kept mum on what he doesn't know.. God bless you Senator Sir",0.268,0.121,0.611,0.7231,Positive
Al_Jazeera,HfdLO3QwjtA,@gilbertsimon7076,This man have talk well and may God bless him ooo,33,2025-03-10T10:42:38Z,0,YouTube,This man have talk well and may God bless him ooo,0.467,0.0,0.533,0.7184,Positive
Al_Jazeera,HfdLO3QwjtA,@nwachukwuugochukwu7816,"If dis man was a current senator, he would have been suspended for 4yrs for revealing too much in d senate politics 😂😂😂😂
Democracy in Nigeria is money 💯 
This man spoke hard truth😂",14,2025-03-10T13:10:13Z,2,YouTube,"If dis man was a current senator, he would have been suspended for 4yrs for revealing too much in d senate politics Democracy in Nigeria is money This man spoke hard truth",0.064,0.126,0.81,-0.296,Negative
Al_Jazeera,HfdLO3QwjtA,@Bbox12,This man is brutally honest. The Anchors knows it but they won't admit it on air.,5,2025-03-10T15:57:42Z,0,YouTube,This man is brutally honest. The Anchors knows it but they won't admit it on air.,0.11,0.225,0.665,-0.3045,Negative
Al_Jazeera,HfdLO3QwjtA,@freedomtv-gs6ke,The best guest and interview I have watched on Arise. He is an honest man.,4,2025-03-10T22:27:01Z,0,YouTube,The best guest and interview I have watched on Arise. He is an honest man.,0.366,0.0,0.634,0.8176,Positive
Al_Jazeera,HfdLO3QwjtA,@julitachukwudimoemeke7577,"Thanks Arise News for giving ur guest enough time to air his views without being rushed, though I believed with the level of his wisdom he must have negotiated with u guys for it b4 coming.
God bless Ogunlewe for being truthful, letting the senate know what they did to Natasha is wrong.",2,2025-03-11T00:58:30Z,0,YouTube,"Thanks Arise News for giving ur guest enough time to air his views without being rushed, though I believed with the level of his wisdom he must have negotiated with u guys for it b4 coming.God bless Ogunlewe for being truthful, letting the senate know what they did to Natasha is wrong.",0.228,0.049,0.723,0.886,Positive
Al_Jazeera,HfdLO3QwjtA,@Veebee-c6h,"I have thoroughly enjoyed watching this interview with Senator Ogunlewe. 
The man has a way of saying the truth in a hilarious way!
Absolutely love him 😂",14,2025-03-10T12:33:55Z,1,YouTube,I have thoroughly enjoyed watching this interview with Senator Ogunlewe. The man has a way of saying the truth in a hilarious way!Absolutely love him,0.384,0.0,0.616,0.9199,Positive
Al_Jazeera,HfdLO3QwjtA,@princessphinagarba3789,"Ayo was spot on with me on the example of a young daughter reporting a sexual harassment case and the consequences of refusing, by her boss/superior officer to her dad. As a young lady fresh out of college, I had such an experience from an overall male boss. He kept on pestering and threatening me, sending older women to convince me and promising me heaven on earth if only I accepted his promiscuous and nonsensical sexual advances. I  reported the matter to my Dad when I couldn't hold back anymore. I remember that my Dad took the matter up with the chairman of the board of directors. Nothing was done about it, apart from the chairman apologising on the man's behalf. The next best thing I could do then was to look for another job elsewhere. The alternative for me was to resign and stay at home. 

Senator Natasha Akpoti-Uduaghan must have been pushed to the wall, most likely, haven't been made to suffer the consequences of refusal severally on the floor of the house, as she stated, by a fellow senator who happened to be just a first amongst equals by an in-house vote. 

Since not all Nigerian men are like that (these are  about 5 - 10%), the sane minority groups should join forces with the majority of Nigerian women who abhor such crime to say ""No"" to these randy pigs, and work against all odds to eradicate this societal nuisance,  legally. This injustice must not be allowed to continue.",10,2025-03-10T15:07:49Z,0,YouTube,"Ayo was spot on with me on the example of a young daughter reporting a sexual harassment case and the consequences of refusing, by her bosssuperior officer to her dad. As a young lady fresh out of college, I had such an experience from an overall male boss. He kept on pestering and threatening me, sending older women to convince me and promising me heaven on earth if only I accepted his promiscuous and nonsensical sexual advances. I reported the matter to my Dad when I couldn't hold back anymore. I remember that my Dad took the matter up with the chairman of the board of directors. Nothing was done about it, apart from the chairman apologising on the man's behalf. The next best thing I could do then was to look for another job elsewhere. The alternative for me was to resign and stay at home. Senator Natasha Akpoti-Uduaghan must have been pushed to the wall, most likely, haven't been made to suffer the consequences of refusal severally on the floor of the house, as she stated, by a fellow senator who happened to be just a first amongst equals by an in-house vote. Since not all Nigerian men are like that these are about 5 - 10, the sane minority groups should join forces with the majority of Nigerian women who abhor such crime to say No to these randy pigs, and work against all odds to eradicate this societal nuisance, legally. This injustice must not be allowed to continue.",0.091,0.104,0.804,-0.8305,Negative
Al_Jazeera,HfdLO3QwjtA,@UgwokeLonglive,"This guest is saying the truth, the senate president rushed the whole thing and didn’t want to be exposed, again he said that Nathasher’s beauty is coursing her problems",8,2025-03-10T12:55:25Z,0,YouTube,"This guest is saying the truth, the senate president rushed the whole thing and didnt want to be exposed, again he said that Nathashers beauty is coursing her problems",0.173,0.148,0.679,0.4363,Positive
Al_Jazeera,HfdLO3QwjtA,@evansanozie9813,A sane person will not venture into Nigerian politics... this man said the truth,2,2025-03-10T22:21:22Z,0,YouTube,A sane person will not venture into Nigerian politics... this man said the truth,0.15,0.0,0.85,0.3182,Positive
Al_Jazeera,HfdLO3QwjtA,@oludareeniola7688,Thank you sir for exposed them all. Moneycracy practicing in Nigeria politics not democracy,1,2025-03-11T05:21:13Z,0,YouTube,Thank you sir for exposed them all. Moneycracy practicing in Nigeria politics not democracy,0.158,0.082,0.759,0.296,Positive
Al_Jazeera,HfdLO3QwjtA,@tesis.4353,"Senator Ogunlewe was doing very well at the beginning of the discussion. He went off “left field” when he said Senator Akpoti’s beauty was her problem, and that was where he missed the road. He improved on his messages with his recommendations to the current and past members of the Senate.",19,2025-03-10T16:40:10Z,5,YouTube,"Senator Ogunlewe was doing very well at the beginning of the discussion. He went off left field when he said Senator Akpotis beauty was her problem, and that was where he missed the road. He improved on his messages with his recommendations to the current and past members of the Senate.",0.154,0.081,0.764,0.659,Positive
Al_Jazeera,HfdLO3QwjtA,@HartGogo-e8k,"I absolutely agree, that this is the best interview for this month. 😂 Thank you Arise news for this",25,2025-03-10T15:35:29Z,1,YouTube,"I absolutely agree, that this is the best interview for this month. Thank you Arise news for this",0.388,0.0,0.612,0.8588,Positive
Al_Jazeera,HfdLO3QwjtA,@innocentamaefule1594,"Oh, 😂😂😂😂my God, I haven't laughed so had such i did after listening to this program, this man is so open that he had nothing to hide as long as he knows it, and other politicians won't be happy with him after this interview, but the truth is that we are in a big problem in this country, Nigeria is gone. Anyway, thank you, my brave Ayo, woman with beauty and brain for your bold questions. You guys rock ✌️",50,2025-03-10T11:32:21Z,5,YouTube,"Oh, my God, I haven't laughed so had such i did after listening to this program, this man is so open that he had nothing to hide as long as he knows it, and other politicians won't be happy with him after this interview, but the truth is that we are in a big problem in this country, Nigeria is gone. Anyway, thank you, my brave Ayo, woman with beauty and brain for your bold questions. You guys rock",0.225,0.074,0.701,0.9425,Positive
Al_Jazeera,HfdLO3QwjtA,@olamigokeanuoluwapo9755,This man speaks from practical experience…. May God deliver Nigeria,1,2025-03-11T09:41:33Z,0,YouTube,This man speaks from practical experience. May God deliver Nigeria,0.189,0.0,0.811,0.2732,Positive
Al_Jazeera,HfdLO3QwjtA,@Oniluote,"This is the best episode of Nigeria analysis with this great man. I am willing to meet this man.

His response about senator Natasha was on point just that he didn't find the right words to explain it. 
His projections about the money game is just a simple plot to believe.

All in all, I love his bluntness.",3,2025-03-12T09:26:21Z,0,YouTube,"This is the best episode of Nigeria analysis with this great man. I am willing to meet this man.His response about senator Natasha was on point just that he didn't find the right words to explain it. His projections about the money game is just a simple plot to believe.All in all, I love his bluntness.",0.2,0.0,0.8,0.9357,Positive
Al_Jazeera,HfdLO3QwjtA,@emie4965,I always appreciate this elder statesman. So damn honest... calls a spade a spade! However ugly the truth is he always tells it. God bless you Chief Ogunlewe:),12,2025-03-10T13:26:32Z,0,YouTube,I always appreciate this elder statesman. So damn honest... calls a spade a spade! However ugly the truth is he always tells it. God bless you Chief Ogunlewe,0.331,0.163,0.505,0.7166,Positive
Al_Jazeera,HfdLO3QwjtA,@ipinlojutemitope636,"To be bold and courageous enough to say the truth in this country is not easy , credibility to the formal Senator Ogunlewe",10,2025-03-10T15:57:53Z,1,YouTube,"To be bold and courageous enough to say the truth in this country is not easy , credibility to the formal Senator Ogunlewe",0.279,0.081,0.64,0.709,Positive
Al_Jazeera,HfdLO3QwjtA,@orishpets6574,Thank you thank you Senator Ogunlewe. Proud to know that we still have few political leaders in Nigeria that can stand by the truth.,7,2025-03-10T15:39:38Z,0,YouTube,Thank you thank you Senator Ogunlewe. Proud to know that we still have few political leaders in Nigeria that can stand by the truth.,0.342,0.0,0.658,0.8555,Positive
Al_Jazeera,HfdLO3QwjtA,@Trio_Music_Group,"It's not just about education acquired, but about being ready to continue learning and at all times play according to the laws. 

Senator Natasha should go back and study the Senate rules' book within these period of her suspension very well, so that she won't float in the house again.",1,2025-03-31T15:36:10Z,0,YouTube,"It's not just about education acquired, but about being ready to continue learning and at all times play according to the laws. Senator Natasha should go back and study the Senate rules' book within these period of her suspension very well, so that she won't float in the house again.",0.167,0.0,0.833,0.8569,Positive
Al_Jazeera,HfdLO3QwjtA,@ChristianaEdoh-ju6ve,Sir God bless you abundantly for speaking the truth 🙏 and for exposing everything that goes on in the senate.,1,2025-03-12T15:33:02Z,0,YouTube,Sir God bless you abundantly for speaking the truth and for exposing everything that goes on in the senate.,0.296,0.086,0.617,0.6249,Positive
Al_Jazeera,HfdLO3QwjtA,@weenchukusa5032,"Distinguished Senator Ogunlewe has been down to earth. He held a high ground in this discourse. Nigeria needs urgent reform or our future will remain mortgaged. The Arise team did their best to challenge the decay in our political system with a sense of humorous. I enjoyed the programme as it exposed the good, the bad and the ugly of Nigeria politics. Well done.",8,2025-03-10T15:44:21Z,0,YouTube,"Distinguished Senator Ogunlewe has been down to earth. He held a high ground in this discourse. Nigeria needs urgent reform or our future will remain mortgaged. The Arise team did their best to challenge the decay in our political system with a sense of humorous. I enjoyed the programme as it exposed the good, the bad and the ugly of Nigeria politics. Well done.",0.222,0.132,0.646,0.7506,Positive
Al_Jazeera,HfdLO3QwjtA,@mariamjibril1708,"Thank you sir, u are truly a good man",27,2025-03-10T11:19:54Z,1,YouTube,"Thank you sir, u are truly a good man",0.58,0.0,0.42,0.8074,Positive
Al_Jazeera,HfdLO3QwjtA,@Beloved-06-60,"I love Ayo so much, she is very intelligent and her point is well articulated! ❤❤
Chief Ogunlewe well-done, you spoke very well",40,2025-03-10T15:29:27Z,0,YouTube,"I love Ayo so much, she is very intelligent and her point is well articulated! Chief Ogunlewe well-done, you spoke very well",0.406,0.0,0.594,0.9058,Positive
Al_Jazeera,HfdLO3QwjtA,@stephenstarvos5992,"My admiration goes to all the Arise team members, well experienced and professional in their field of specialization and best known to use appropriate words. Learning so much from you all",0,2025-03-27T08:23:06Z,0,YouTube,"My admiration goes to all the Arise team members, well experienced and professional in their field of specialization and best known to use appropriate words. Learning so much from you all",0.259,0.0,0.741,0.8689,Positive
Al_Jazeera,HfdLO3QwjtA,@MohammedNdaasabe,Sir you will live long for saying the truth.,1,2025-03-10T19:46:47Z,0,YouTube,Sir you will live long for saying the truth.,0.223,0.0,0.777,0.3182,Positive
Al_Jazeera,HfdLO3QwjtA,@ronicksamuel2912,"this is what it means to be an elder states man, baba just balance the equation, God bless you sir 🤗🤗",8,2025-03-10T13:58:12Z,0,YouTube,"this is what it means to be an elder states man, baba just balance the equation, God bless you sir",0.214,0.0,0.786,0.5994,Positive
Al_Jazeera,HfdLO3QwjtA,@olusegunemmanueloladejo953,"This baba is very experience in nigeria politics,  he's saying the truth all round. Kudos to you sir",25,2025-03-10T12:53:09Z,1,YouTube,"This baba is very experience in nigeria politics, he's saying the truth all round. Kudos to you sir",0.259,0.0,0.741,0.6808,Positive
Al_Jazeera,HfdLO3QwjtA,@tessynat,Am lost for words listening to this interview. What a nation.,7,2025-03-10T12:30:25Z,1,YouTube,Am lost for words listening to this interview. What a nation.,0.0,0.187,0.813,-0.3182,Negative
Al_Jazeera,HfdLO3QwjtA,@isaacebhohimhen1495,"God will bless this man for his bluntness. Although, what he is saying is not new.",1,2025-03-11T00:13:46Z,0,YouTube,"God will bless this man for his bluntness. Although, what he is saying is not new.",0.259,0.0,0.741,0.5994,Positive
Al_Jazeera,HfdLO3QwjtA,@daisiegunjobi728,"Thank you so much sir, i can have assurance in my country again that elder who can put things in order still here with us, long life and prosperity.",0,2025-03-14T00:29:27Z,0,YouTube,"Thank you so much sir, i can have assurance in my country again that elder who can put things in order still here with us, long life and prosperity.",0.154,0.0,0.846,0.5994,Positive
Al_Jazeera,HfdLO3QwjtA,@Stanly2010able,"Distinguished Senator Ogunlewe, Sir ,Thank you for being forthright, honest and truthful!!
With men like you, there is still hope that Nigeria can be salvaged.

These tyrants masquerading as senators will be made to answer to Nigerians as God Almighty exists.",20,2025-03-10T12:33:11Z,1,YouTube,"Distinguished Senator Ogunlewe, Sir ,Thank you for being forthright, honest and truthful!!With men like you, there is still hope that Nigeria can be salvaged.These tyrants masquerading as senators will be made to answer to Nigerians as God Almighty exists.",0.29,0.0,0.71,0.9167,Positive
Al_Jazeera,HfdLO3QwjtA,@OgechukwuJoseph-q5h,The press must stay on this issue until the right thing is done. You guys are doing great. Mr Akpabio must step aside for proper investigation,10,2025-03-10T12:01:49Z,3,YouTube,The press must stay on this issue until the right thing is done. You guys are doing great. Mr Akpabio must step aside for proper investigation,0.141,0.0,0.859,0.6249,Positive
Al_Jazeera,HfdLO3QwjtA,@clarak.mallah4137,"He is such an intelligent and interesting gentleman 😂😂😂 Go, but find your way out😂😂",7,2025-03-10T14:18:09Z,0,YouTube,"He is such an intelligent and interesting gentleman Go, but find your way out",0.243,0.0,0.757,0.431,Positive
Al_Jazeera,HfdLO3QwjtA,@OlagundoyeGbemi,"This man said the truth 
Money is important in Nigeria politics, can Arise Tv 📺 transmit 5 hours for free for politicians",1,2025-03-10T20:00:04Z,0,YouTube,"This man said the truth Money is important in Nigeria politics, can Arise Tv transmit 5 hours for free for politicians",0.291,0.0,0.709,0.7506,Positive
Al_Jazeera,HfdLO3QwjtA,@christianasktoluwase2893,THANK YOU PA OGUNLEWE GOD BLESS YOU SIR,1,2025-03-11T02:59:15Z,0,YouTube,THANK YOU PA OGUNLEWE GOD BLESS YOU SIR,0.597,0.0,0.403,0.7506,Positive
Al_Jazeera,HfdLO3QwjtA,@oritsejolomiokoro6408,This is about the most enlightened comments / remarks by this distinguished senator on this matter.,5,2025-03-10T12:34:58Z,0,YouTube,This is about the most enlightened comments remarks by this distinguished senator on this matter.,0.262,0.0,0.738,0.56,Positive
Al_Jazeera,HfdLO3QwjtA,@aneadobe1545,Very mature and experienced perspective. Always a pleasure listening to Senator Ogunlewe,10,2025-03-10T12:46:13Z,0,YouTube,Very mature and experienced perspective. Always a pleasure listening to Senator Ogunlewe,0.405,0.0,0.595,0.7778,Positive
Al_Jazeera,HfdLO3QwjtA,@gloriaovayioza,You are loved daddy 🥰 at least there's hope thst we have a father in our country that still says the truth.,7,2025-03-10T11:55:08Z,0,YouTube,You are loved daddy at least there's hope thst we have a father in our country that still says the truth.,0.336,0.0,0.664,0.8442,Positive
Al_Jazeera,HfdLO3QwjtA,@roseiwueke2206,"Daddy you’re the only one that has spoken well , thank sir.",1,2025-03-10T19:55:20Z,0,YouTube,"Daddy youre the only one that has spoken well , thank sir.",0.315,0.0,0.685,0.5574,Positive
Al_Jazeera,HfdLO3QwjtA,@bolanlealawode4918,"Welldone sir, thank you for speaking the truth behind Nigeria's politics 
Kudos to Arise News by inviting Senator Ogunlewe to give us an incite 😂😂 DEMOCRACY IN NIGERIA =MONEYCRACY !!! WOW
ENJOY YOU ALL",1,2025-03-28T14:31:39Z,0,YouTube,"Welldone sir, thank you for speaking the truth behind Nigeria's politics Kudos to Arise News by inviting Senator Ogunlewe to give us an incite DEMOCRACY IN NIGERIA MONEYCRACY !!! WOWENJOY YOU ALL",0.287,0.0,0.713,0.8827,Positive
Al_Jazeera,HfdLO3QwjtA,@blazekonceptz8771,His honesty is out of this world.,5,2025-03-10T13:01:35Z,0,YouTube,His honesty is out of this world.,0.348,0.0,0.652,0.4939,Positive
Al_Jazeera,HfdLO3QwjtA,@timiademiluyi2775,"- Any sexual advances from a boss to his or her subordinate is called harassment & considered a crime. The question is, what do we do about Akpabio? since all these other senators have ganged up against Natasha. who is going to call them to order? Very sad situation.",13,2025-03-10T11:57:23Z,3,YouTube,"- Any sexual advances from a boss to his or her subordinate is called harassment considered a crime. The question is, what do we do about Akpabio? since all these other senators have ganged up against Natasha. who is going to call them to order? Very sad situation.",0.0,0.193,0.807,-0.8946,Negative
Al_Jazeera,HfdLO3QwjtA,@jokebalogun6932,I like this man’s answer to all Arise questions.,6,2025-03-10T13:17:53Z,0,YouTube,I like this mans answer to all Arise questions.,0.238,0.0,0.762,0.3612,Positive
Al_Jazeera,HfdLO3QwjtA,@therealayokunle,"This man just showed that you can be a member of APC, and be sincere. Can't believe I am saying this about an APC member",1,2025-03-10T21:32:53Z,0,YouTube,"This man just showed that you can be a member of APC, and be sincere. Can't believe I am saying this about an APC member",0.101,0.0,0.899,0.4019,Positive
Al_Jazeera,HfdLO3QwjtA,@viavoakran,It is always enlightening to listen and learn from the Senator. He has always been on the money with his views on issues. He tells it like it is. May The Good Lord grant him long life and good health so we can continue to reap from his knowledge and wisdom. Godspeed .,0,2025-04-13T08:52:53Z,0,YouTube,It is always enlightening to listen and learn from the Senator. He has always been on the money with his views on issues. He tells it like it is. May The Good Lord grant him long life and good health so we can continue to reap from his knowledge and wisdom. Godspeed .,0.271,0.0,0.729,0.9477,Positive
Al_Jazeera,HfdLO3QwjtA,@samjeff6063,Natasha came to Arise tv to make her sexual harrassment confession. But Arise was not just patient with her to fully give out all her confession. But they have spent over a  week now analyzing the issue.,9,2025-03-10T13:46:34Z,1,YouTube,Natasha came to Arise tv to make her sexual harrassment confession. But Arise was not just patient with her to fully give out all her confession. But they have spent over a week now analyzing the issue.,0.0,0.0,1.0,0.0,Neutral
Al_Jazeera,HfdLO3QwjtA,@RitaCharles-rt2cp,Someone should share this till it get to Akpabio and his men so they listen amd learn again..,5,2025-03-10T13:55:02Z,1,YouTube,Someone should share this till it get to Akpabio and his men so they listen amd learn again..,0.115,0.0,0.885,0.296,Positive
Al_Jazeera,HfdLO3QwjtA,@Speech-In-SightsPhotography,"Ayo, Are you a lawyer ? or did you study law as a side course/ elective ?Your interrogation and insight is superb !",9,2025-03-10T13:26:29Z,1,YouTube,"Ayo, Are you a lawyer ? or did you study law as a side course elective ?Your interrogation and insight is superb !",0.178,0.0,0.822,0.6958,Positive
Al_Jazeera,HfdLO3QwjtA,@AkachukwuAkaobasi-gg3ku,"Iam grateful for Arise t.v inviting this truthful elderly man, Senator Ogudele to this Arise Morning show. I learnt a lot of things from him through his reply to the questions put up to him and i know,he answers the questions truly and correct,May the Almighty God bless and guide him in Jesus name.",1,2025-03-12T12:53:35Z,0,YouTube,"Iam grateful for Arise t.v inviting this truthful elderly man, Senator Ogudele to this Arise Morning show. I learnt a lot of things from him through his reply to the questions put up to him and i know,he answers the questions truly and correct,May the Almighty God bless and guide him in Jesus name.",0.257,0.0,0.743,0.9393,Positive
Al_Jazeera,HfdLO3QwjtA,@funkeoladipo1590,A very honest and sincere experienced Senator. God bless you real good 👍 🎉. We need more upright God fearing men and women in our polity.❤,1,2025-03-10T19:15:09Z,0,YouTube,A very honest and sincere experienced Senator. God bless you real good . We need more upright God fearing men and women in our polity.,0.432,0.102,0.465,0.895,Positive
